7917,徐州羊圈圈网络生活服务科技有限公司,91320311MAC737772U,新增导入,互联网平台,数据资源企业,,,,,,,,,,,,,在业,2023-01-16,10万元,-,徐州市,鼓楼区,0,XS(微型),"徐州羊圈圈网络生活服务科技有限公司成立于2023-01-16，法定代表人为赵瑞华，注册资本为10万元，统一社会信用代码为91320311MAC737772U，企业注册地址位于江苏省徐州市鼓楼区中山北路226号鼓楼广场项目内B1F01-2号商铺，所属行业为科技推广和应用服务业，经营范围包含：许可项目：食品销售（依法须经批准的项目，经相关部门批准后方可开展经营活动，具体经营项目以审批结果为准）
一般项目：科技推广和应用服务；网络技术服务；人工智能公共服务平台技术咨询服务；大数据服务；数据处理和存储支持服务；物联网应用服务；家政服务；居民日常生活服务；摄像及视频制作服务；专业保洁、清洗、消毒服务；宠物服务（不含动物诊疗）；住宅水电安装维护服务；个人互联网直播服务；供应链管理服务；企业形象策划；物联网技术研发；农副产品销售；日用百货销售；家用电器销售；医护人员防护用品零售；食用农产品零售；新鲜水果零售；新鲜蔬菜零售；宠物食品及用品零售；互联网销售（除销售需要许可的商品）；食品互联网销售（仅销售预包装食品）；物业管理；洗车服务；汽车装饰用品销售；汽车零配件零售；二手车鉴定评估；机动车修理和维护；二手车经纪；食品销售（仅销售预包装食品）；餐饮管理；气体、液体分离及纯净设备销售；商业、饮食、服务专用设备销售；厨具卫具及日用杂品零售（除依法须经批准的项目外，凭营业执照依法自主开展经营活动）。企业当前经营状态为在业。",科学研究和技术服务业,科技推广和应用服务业,-,-
30970,江苏兴油工程技术服务有限公司,91321091MA1Q5HLBXM,规上,,数据资源企业,,,,,,,,,,,,,在业,2017-08-28,1000万元,1000万元,扬州市,扬州经济技术开发区,1726,M(中型),"江苏兴油工程技术服务有限公司成立于2017-08-28，法定代表人为黄开铭，注册资本为1000万元，统一社会信用代码为91321091MA1Q5HLBXM，企业注册地址位于扬州市经济开发区邗江中路119号扬州国际人力资源服务产业园内二期办公楼，所属行业为研究和试验发展，经营范围包含：石油勘探、开发技术服务；石油、天然气工程技术服务；石油建设工程服务；元明粉、卤水生产技术服务；土木建筑工程设计、施工、勘察；工程监理；物业管理；通信、网络技术服务；计算机软硬件销售及技术开发、技术转让、技术服务；建筑劳务分包；建筑工程施工；建筑用机械设备、水电、水暖器材、机电设备、智能化设备安装；人力资源服务外包；境内劳务派遣经营，向境外派遣各类劳务人员（不含港澳台地区）；数据处理服务；会议及展览服务；餐饮服务；润滑油销售；车辆维修；代办车辆上牌、过户、年审、换证服务；汽车零配件、轮胎销售；汽车租赁服务。（依法须经批准的项目，经相关部门批准后方可开展经营活动##）
许可项目：道路货物运输（不含危险货物）；道路货物运输（网络货运）；各类工程建设活动；代理记账；职业中介活动（依法须经批准的项目，经相关部门批准后方可开展经营活动，具体经营项目以审批结果为准）
一般项目：建筑工程机械与设备租赁；计算机及通讯设备租赁；运输设备租赁服务；医疗设备租赁；办公设备租赁服务；装卸搬运；国内货物运输代理；单位后勤管理服务；特种劳动防护用品销售；财务咨询；机械设备租赁；业务培训（不含教育培训、职业技能培训等需取得许可的培训）（除依法须经批准的项目外，凭营业执照依法自主开展经营活动）。企业当前经营状态为在业。",科学研究和技术服务业,研究和试验发展,工程和技术研究和试验发展,工程和技术研究和试验发展
8243,高邮普澜智慧物联有限公司,91321084MA7LN9KD2Y,新增导入,区块链,数据基础设施企业,数据存算设施,,,,,,,,,,,,存续,2022-03-29,20万元,-,扬州市,高邮市,0,XS(微型),高邮普澜智慧物联有限公司成立于2022-03-29，法定代表人为张爱文，注册资本为20万元，统一社会信用代码为91321084MA7LN9KD2Y，企业注册地址位于高邮市三垛镇东楼村三组（高邮市盛鑫消防科技有限公司内办公楼3楼306室），所属行业为软件和信息技术服务业，经营范围包含：一般项目：物联网技术研发；物联网技术服务；物联网应用服务；企业形象策划；税务服务；财务咨询；市场营销策划；信息技术咨询服务；技术服务、技术开发、技术咨询、技术交流、技术转让、技术推广；非居住房地产租赁；汽车新车销售；新能源汽车整车销售；汽车零配件零售；汽车零配件批发；汽车装饰用品销售；建筑材料销售；轻质建筑材料销售；建筑装饰材料销售；食品销售（仅销售预包装食品）；消防器材销售；计算机软硬件及辅助设备批发；计算机软硬件及辅助设备零售；计算机系统服务；软件销售；信息系统运行维护服务；广告设计、代理；广告发布；广告制作；品牌管理；平面设计；网络设备销售；网络技术服务；网络与信息安全软件开发；信息安全设备销售；信息系统集成服务（除依法须经批准的项目外，凭营业执照依法自主开展经营活动）。企业当前经营状态为存续。,信息传输、软件和信息技术服务业,软件和信息技术服务业,信息系统集成和物联网技术服务,物联网技术服务
8505,灌云祥羽数据服务有限公司,91320723MAE3XF5J35,新增导入,,数据应用企业,工业制造,,,,,,,,,,,,存续,2024-11-07,10万元,10万元,连云港市,灌云县,0,XS(微型),灌云祥羽数据服务有限公司成立于2024-11-07，法定代表人为潘祥，注册资本为10万元，统一社会信用代码为91320723MAE3XF5J35，企业注册地址位于江苏省连云港市灌云县伊山镇山前村三组272号，所属行业为互联网和相关服务，经营范围包含：一般项目：互联网数据服务；数据处理服务；线下数据处理服务；数据处理和存储支持服务；数字技术服务；工业互联网数据服务；技术服务、技术开发、技术咨询、技术交流、技术转让、技术推广；技术推广服务；企业形象策划；市场营销策划；咨询策划服务；项目策划与公关服务；企业管理咨询；平面设计；专业设计服务；广告设计、代理；办公用品销售；图文设计制作；日用百货销售（除依法须经批准的项目外，凭营业执照依法自主开展经营活动）。企业当前经营状态为存续。,信息传输、软件和信息技术服务业,互联网和相关服务,互联网数据服务,互联网数据服务
27322,苏州创捷传媒展览股份有限公司,91320500726662177H,规上,,数据应用企业,,,,,,,,,,,,,在业,2001-03-05,4300万元,4300万元,苏州市,虎丘区,90,S(小型),"苏州创捷传媒展览股份有限公司成立于2001年3月，董事长为毛小松。公司是专业从事高科技主题展馆设计营造的服务商，具备展览工程一级资质和建筑装饰设计甲级资质。公司业务涵盖主题展馆设计、数字孪生技术研发、文化科技融合项目开发等领域，在苏州、北京、上海等地设有分支机构。公司旗下拥有上海摩奇贝斯设计营造有限公司和杭州元户动漫科技有限公司两家子公司。
苏州创捷传媒展览股份有限公司在2025年入选省级专精特新中小企业和省级创新型中小企业，并连续多年保持国家级高新技术企业资质。在数字化与体验经济深度融合的背景下，该公司依托长三角地区的产业集聚优势，将数字孪生技术与文化科技融合项目开发相结合，形成了差异化的技术竞争力。随着展厅设计行业从空间装饰向战略叙事升级，该公司通过整合策划、设计、实施全流程服务能力，在主题展馆领域建立了专业化的服务模式。
以上内容由AI生成，仅供参考，请注意甄别。",文化、体育和娱乐业,文化艺术业,-,-
25771,江苏苏豪国际会展股份有限公司,913201006825462537,规上,,数据服务企业,,,,,,,,,,,,,在业,2009-03-16,20000万元,20000万元,南京市,秦淮区,60,S(小型),江苏苏豪国际会展股份有限公司成立于2009-03-16，法定代表人为田勇，注册资本为20000万元，统一社会信用代码为913201006825462537，企业注册地址位于南京市秦淮区白下路91号，所属行业为商务服务业，经营范围包含：一般项目：会议及展览服务；组织文化艺术交流活动；票务代理服务；信息咨询服务（不含许可类信息咨询服务）；货物进出口；技术进出口；进出口代理；非居住房地产租赁；广告设计、代理；广告制作；食品销售（仅销售预包装食品）；农副产品销售（除依法须经批准的项目外，凭营业执照依法自主开展经营活动）。企业当前经营状态为在业。,租赁和商务服务业,商务服务业,会议、展览及相关服务,-
25984,南京普阑尼信息技术有限公司,913201143026082732,规上,,数据安全企业,,,,,,,,,,,,,存续,2014-05-16,2000万元,234.538万元,南京市,雨花台区,10,S(小型),"南京普阑尼信息技术有限公司成立于2014年5月，法定代表人为邓琳。公司专注于云计算、物联网、大数据、人工智能、网络安全等领域的技术研发与服务，提供基础网络建设改造、数据中心建设改造、网络安全建设与服务、智慧场景建设、智慧应用建设等信息化服务。公司秉持'资源整合实现各方价值'的理念，以客户需求为导向，以技术创新为基础，以专业服务为支撑，致力于构建信息化领域的生态合作平台。
南京普阑尼信息技术有限公司在2025年获得省级产学研合作项目和国家级科技型中小企业称号，2023年被评为省级创新型中小企业。该公司与江苏、河南两省50余所高等院校信息中心合作，为高职院校提供专业建设和网络安全服务。作为网易有道信息技术（北京）有限公司在江苏地区的唯一授权经销商，南京普阑尼信息技术有限公司在数字艺术设计赛项设备领域具有独特优势。
以上内容由AI生成，仅供参考，请注意甄别。",信息传输、软件和信息技术服务业,软件和信息技术服务业,信息技术咨询服务,信息技术咨询服务
6926,无锡宏业成网络科技有限公司,91320211MA1QF0T761,新增导入,数据加密,数据安全企业,专精型数据安全,,,,,,,,,,,,存续,2017-09-04,800万元,744.9万元,无锡市,新吴区,12,S(小型),"无锡宏业成网络科技有限公司成立于2017年9月，法定代表人尤宏勤，公司位于江苏省无锡市新吴区。作为一家专注于信息技术领域的企业，公司主营业务包括信息系统集成服务、技术服务以及计算机软硬件的研发。公司拥有多项专利技术，涉及云数据加密和在线交易账户系统等领域，并开发了煤机物联管控系统、合同智能编制管理系统、项目全周期智能监管系统等软件产品。无锡宏业成网络科技有限公司持有软件企业证书，体现了其在软件开发和服务方面的专业能力。
无锡宏业成网络科技有限公司入选2025年国家级科技型中小企业和2023年省级创新型中小企业。在信息技术服务领域，该公司通过云数据加密和在线交易账户系统等专利技术，提升在系统集成和软件研发方面的竞争力。
以上内容由AI生成，仅供参考，请注意甄别。",科学研究和技术服务业,科技推广和应用服务业,-,-
26583,苏州宏云智能科技有限公司,91320594MA1M9J2B23,规上,,数据技术企业,,,,,,,,,,,,,在业,2015-10-14,6055.36万元,2630.645076万元,苏州市,虎丘区,49,S(小型),"苏州宏云智能科技有限公司成立于2015年，董事长为赵飞。公司以HOMYCLOUD为产品商标，专注于为住宅用户提供智慧生活解决方案。总部位于苏州，负责云平台、大数据和人工智能技术研发及后台服务运营，并在北京、上海、深圳设有分公司负责客户对接和渠道管理。公司整合人工智能、云服务、语音识别、环境监测和物联网技术，结合工业设计和行为数据分析，研发住宅控制技术和生活理念。
苏州宏云智能科技有限公司2025年获得省级瞪羚企业和国家级科技型中小企业称号，2024年被评为省级民营科技企业。该公司在苏州市具身智能产业政策支持下，深度整合人工智能、云平台服务等技术，专注于住宅控制技术研发。苏州市副市长曾带队走访该公司，关注其产品研发应用和发展规划。苏州工业园区作为具身智能产业核心区，为该公司的技术研发提供了良好的区域环境。
以上内容由AI生成，仅供参考，请注意甄别。",信息传输、软件和信息技术服务业,软件和信息技术服务业,软件开发,-
16589,南京号坤信息技术有限公司,91320113MA1YW7DA8Y,填报,,数据技术企业,,,,,,,,,,,,,在业,2019-08-09,500万元,-,南京市,秦淮区,0,XS(微型),南京号坤信息技术有限公司成立于2019-08-09，法定代表人为李晓娜，注册资本为500万元，统一社会信用代码为91320113MA1YW7DA8Y，企业注册地址位于南京市秦淮区光华路162号研发孵化综合楼6楼629，所属行业为软件和信息技术服务业，经营范围包含：信息技术咨询、技术服务；集成电路设计；安防工程设计、施工；信息系统集成服务；自动化控制系统安装；电子技术、通信技术研发、技术转让、技术咨询、技术服务；软件开发；计算机软硬件技术研发、技术转让、技术咨询、技术服务、销售；办公自动化用品、通讯设备、五金交电、机械设备、电子设备销售。（依法须经批准的项目，经相关部门批准后方可开展经营活动）。企业当前经营状态为在业。,信息传输、软件和信息技术服务业,软件和信息技术服务业,-,-
9091,江苏嘉满仓现代农业科技有限公司,91320981MA1W6EGB04,新增导入,,数据技术企业,数据采集汇聚,,,,,,,,,,,,在业,2018-03-12,9999.92万元,-,盐城市,东台市,12,S(小型),"江苏嘉满仓现代农业科技有限公司成立于2018年3月12日，法定代表人为朱进，企业属性为国有企业。公司位于江苏省盐城市东台市，专注于现代农业科技研发、种植技术咨询服务和食用农产品初加工业务。公司在农业科技领域拥有多项专利技术，包括农作物种植加工全链条智能化数据采集装置、具有定位洒水功能的果蔬种植大棚、组装式果蔬种植架以及角度可调式果蔬种植遮阳装置等创新成果。
江苏嘉满仓现代农业科技有限公司在2025年获得省级专精特新中小企业和市级工程技术研究中心称号，2024年入选省级上云企业。该公司依托东台市国家现代农业产业园的区位优势和政策支持，引进了荷兰先进的半封闭温室系统、智能农业设备和精准水肥循环技术。通过组建高学历技术团队和开展农业观光旅游业务，其产品销售网络覆盖全国多个主要区域。
以上内容由AI生成，仅供参考，请注意甄别。",科学研究和技术服务业,研究和试验发展,-,-
14132,天合光能（淮安）科技有限公司,91320891MA27RDH08D,自有规上,工业制造应用企业,数据应用企业,工业制造应用企业,,,,,,,,,,,,在业,2022-09-22,65200万元,58800万元,淮安市,淮安经济技术开发区,1699,L(大型),"天合光能（淮安）科技有限公司成立于2022年9月，法定代表人为苗成祥，公司位于江苏省淮安市淮安经济技术开发区。作为光伏技术领域的企业，公司主营业务包括技术服务、技术推广以及太阳能发电技术服务。公司在光伏技术研发方面拥有多项专利，涉及光伏组件涂层、硅片绒面结构、叠层太阳能电池组件及太阳能电池印刷技术等领域。
天合光能（淮安）科技有限公司2025年获得省级绿色工厂和省级先进级智能工厂称号，2024年入选省级智能制造车间。公司在光伏技术研发方面拥有多项专利，涉及光伏组件涂层、硅片绒面结构等领域。依托江苏省的产业政策支持，该公司在光伏技术领域持续创新，通过智能化和绿色化生产提升竞争力。
以上内容由AI生成，仅供参考，请注意甄别。",科学研究和技术服务业,科技推广和应用服务业,-,-
1289,泰州市鑫通信息科技有限公司,91321200301911465H,入库,,数据技术企业,,数据服务企业,,,,,,,,,,,在业,2014-05-04,5000万元,5000万元,泰州市,高港区,23,S(小型),"泰州市鑫通信息科技有限公司成立于2014年5月，法定代表人周寅，企业位于江苏省泰州市高港区。公司主营业务包括计算机网络专业技术咨询服务、计算机网络系统集成及维护。企业拥有多项专利技术，包括基于水上AR动态监管装置、车载服务评价装置等创新产品，并开发了智慧档案库房一体化管控平台、公共安全摄像头监控录播系统等软件。公司持有建筑业企业资质证书、安全生产许可证等专业资质，具备计算机网络系统集成与维护的技术服务能力。
泰州市鑫通信息科技有限公司在2025年获得区/县级企业技术研发中心和省级培育数据企业两项荣誉。该公司在计算机网络系统集成及维护领域具备电子与智能化工程专业承包二级资质，并参与了泰州市特种设备智慧监管阳光工程等政府信息化项目。作为泰州市本土企业，该公司依托当地产业政策支持，在建筑弱电系统集成、物联网技术开发等领域形成技术服务优势。
以上内容由AI生成，仅供参考，请注意甄别。",信息传输、软件和信息技术服务业,-,-,-
9827,南京智数云信息科技有限公司,91320111MA1XEXEP98,自有,,数据技术企业,数据加工分析技术企业,,,,,,,,,,,,在业,2018-11-08,667万元,-,南京市,浦口区,7,XS(微型),"南京智数云信息科技有限公司成立于2018-11-08，法定代表人为史梦军，注册资本为667万元，统一社会信用代码为91320111MA1XEXEP98，企业注册地址位于南京市浦口区江浦街道浦滨大道320号科创总部大厦B座2412室，所属行业为科技推广和应用服务业，经营范围包含：数据库技术、计算机网络科技、数据处理技术、物联网技术、云计算技术、智能技术服务、技术开发、技术咨询、技术转让；计算机软硬件开发、销售；计算机系统集成；数据库管理；信息技术服务；数据处理及存储服务；房地产信息咨询；市场营销策划；企业形象策划；房地产中介；广告设计、制作、代理；日用百货销售。（依法须经批准的项目，经相关部门批准后方可开展经营活动）
一般项目：广告发布（非广播电台、电视台、报刊出版单位）；文化场馆用智能设备制造；可穿戴智能设备销售；可穿戴智能设备制造（除依法须经批准的项目外，凭营业执照依法自主开展经营活动）。企业当前经营状态为在业。",科学研究和技术服务业,科技推广和应用服务业,-,-
11292,昆山品源知识产权运营科技有限公司,91320583MA1URNPA73,自有,,数据技术企业,数据采集汇聚技术企业,,,,,,,,,,,,存续,2017-12-22,100万元,-,苏州市,昆山市,6,XS(微型),昆山品源知识产权运营科技有限公司成立于2017-12-22，法定代表人为张云明，注册资本为100万元，统一社会信用代码为91320583MA1URNPA73，企业注册地址位于昆山市玉山镇祖冲之南路1699号9号房706室，所属行业为软件和信息技术服务业，经营范围包含：知识产权代理服务；计算机科技领域内的技术开发、技术服务、技术转让、技术咨询；无形资产评估咨询服务（不含国有资产）；科技项目申报咨询服务；科技创新与成果转化咨询服务；网站运营技术开发；知识产权数据库维护与开发；知识产权市场调研分析；会务会展服务。（前述经营项目中法律、行政法规规定前置许可经营、限制经营、禁止经营的除外）（依法须经批准的项目，经相关部门批准后方可开展经营活动）。企业当前经营状态为存续。,信息传输、软件和信息技术服务业,软件和信息技术服务业,信息技术咨询服务,信息技术咨询服务
8971,江苏盐连淮网约车管理服务有限公司,91320921MA7GRDGD5T,新增导入,互联网平台,数据资源企业,,,,,,,,,,,,,在业,2022-01-27,1000万元,-,盐城市,响水县,0,S(小型),"江苏盐连淮网约车管理服务有限公司成立于2022-01-27，法定代表人为程俊熙，注册资本为1000万元，统一社会信用代码为91320921MA7GRDGD5T，企业注册地址位于江苏省盐城市响水县经济开发区灌江路政务服务中心3号楼响水创新中心1410室，所属行业为道路运输业，经营范围包含：许可项目：网络预约出租汽车经营服务；道路旅客运输经营；道路货物运输（不含危险货物）；供电业务；网络文化经营；道路货物运输（网络货运）；城市配送运输服务（不含危险货物）（依法须经批准的项目，经相关部门批准后方可开展经营活动，具体经营项目以审批结果为准）
一般项目：电动汽车充电基础设施运营；充电桩销售；汽车新车销售；汽车旧车销售；二手车鉴定评估；二手车经销；新能源汽车整车销售；新能源汽车电附件销售；新能源汽车换电设施销售；电池制造；电容器及其配套设备制造；配电开关控制设备制造；输配电及控制设备制造；集中式快速充电站；机动车充电销售；电力设施器材销售；技术服务、技术开发、技术咨询、技术交流、技术转让、技术推广；广告发布；网络技术服务；数字广告发布；数字广告制作；数字广告设计、代理；信息技术咨询服务；信息系统运行维护服务；计算机软硬件及辅助设备零售；信息系统集成服务；软件销售；物联网技术服务；物联网技术研发；互联网数据服务；数据处理服务；软件外包服务；企业管理咨询；创业投资（限投资未上市企业）；代驾服务；外卖递送服务；国内货物运输代理（除依法须经批准的项目外，凭营业执照依法自主开展经营活动）。企业当前经营状态为在业。",交通运输、仓储和邮政业,道路运输业,城市公共交通运输,出租车客运
15747,南京九天弋智能科技有限公司,91320104302463019Q,填报,,数据技术企业,,,,,,,,,,,,,在业,2014-11-20,501万元,75万元,南京市,江宁区,5,S(小型),"南京九天弋智能科技有限公司成立于2014年11月20日，法定代表人叶元富，位于江苏省南京市江宁区。公司主营业务涵盖信息技术服务、数据处理服务及存储服务，专注于为电力行业提供智能化解决方案。公司拥有多项专利技术，包括电力杆塔高空作业安全保护装置、基于5G超声波输变电站驱鸟电路等，并开发了线缆连接器智能监测系统、导轨坠落应急响应系统等软件产品。这些技术成果体现了公司在电力安全与智能化领域的专业能力。
南京九天弋智能科技有限公司在2025年获得国家级高新技术企业和国家级科技型中小企业两项重要认定。该公司依托电力自动化控制系统和智能监测技术，在电力安全领域形成专业优势。其业务范围涵盖输配变电工程设计和环保工程等环节，显示出在电力产业链中的技术整合能力。
以上内容由AI生成，仅供参考，请注意甄别。",信息传输、软件和信息技术服务业,软件和信息技术服务业,-,-
27332,沫森文化传播（苏州）有限公司,91320506MAC5H26691,规上,,数据应用企业,,,,,,,,,,,,,在业,2023-01-11,1000万元,10万元,苏州市,吴中区,6,XS(微型),"沫森文化传播（苏州）有限公司成立于2023年1月11日，法定代表人周永强，公司位于江苏省苏州市吴中区。作为一家文化传播企业，沫森文化专注于互联网信息服务、数字文化创意内容应用服务、网络文化经营及广告发布等业务领域。公司拥有多项软件著作权，包括智能广告精准发布管理系统、全媒体广告内容管理系统、高效广告费用结算与信息服务平台以及广告投放效果实时监测管理系统，这些技术成果支撑了其在数字文化创意和广告服务领域的业务开展。
沫森文化传播（苏州）有限公司在2025年获得国家级科技型中小企业认定。
以上内容由AI生成，仅供参考，请注意甄别。",文化、体育和娱乐业,文化艺术业,-,-
