8736,淮安飞鸟科技有限公司,91320891MA1MQTUC9R,新增导入,数据挖掘,数据技术企业,数据加工分析,,,,,,,,,,,,存续,2016-08-04,1200万元,5万元,淮安市,淮安经济技术开发区,2,XS(微型),"淮安飞鸟科技有限公司成立于2016年8月，法定代表人为徐维林。公司专注于软件定制化开发，拥有18项软件著作权，为淮安卷烟厂、淮阴工学院等20多家企事业单位提供软件定制服务。公司形成了独特的软件开发、测试和维护标准体系，是江苏省中小型科技企业和民营科技企业。 创始人徐维林毕业于淮阴工学院计算机科学与技术专业，在校期间通过承接淮阴卷烟厂等项目积累了丰富经验，公司发展过程中注重技术创新和标准体系建设。
淮安飞鸟科技有限公司在2025年先后获得国家级高新技术企业、省级民营科技企业和国家级科技型中小企业称号。该公司依托淮安地区的产业政策支持，在软件定制开发领域形成了标准化的技术体系，其技术创新能力得到地方政府和行业的认可。
以上内容由AI生成，仅供参考，请注意甄别。",科学研究和技术服务业,科技推广和应用服务业,-,-
30530,徐州讯远信息咨询服务有限公司,91320382MAD9WM572D,规上,,数据服务企业,,,,,,,,,,,,,存续,2024-02-01,100万元,100万元,徐州市,邳州市,0,XS(微型),徐州讯远信息咨询服务有限公司成立于2024-02-01，法定代表人为梁龙强，注册资本为100万元，统一社会信用代码为91320382MAD9WM572D，企业注册地址位于江苏省徐州市邳州市赵墩镇临港产业园世纪大道22号A幢2-076，所属行业为商务服务业，经营范围包含：一般项目：信息咨询服务（不含许可类信息咨询服务）；信息技术咨询服务；技术服务、技术开发、技术咨询、技术交流、技术转让、技术推广；技术推广服务；市场营销策划；咨询策划服务；商务代理代办服务；新鲜蔬菜批发；新鲜蔬菜零售；初级农产品收购；农副产品销售（除依法须经批准的项目外，凭营业执照依法自主开展经营活动）。企业当前经营状态为存续。,租赁和商务服务业,商务服务业,咨询与调查,-
10884,南京晔创信息科技有限公司,91320115MAE90YXN15,自有,,数据服务企业,数据经纪企业,,,,,,,,,,,,存续,2024-12-27,500万元,-,南京市,江宁区,-,S(小型),南京晔创信息科技有限公司成立于2024-12-27，法定代表人为刘洪强，注册资本为500万元，统一社会信用代码为91320115MAE90YXN15，企业注册地址位于江苏省南京市江宁区秣陵街道清水亭东路775号2幢501-509室（江宁开发区），所属行业为科技推广和应用服务业，经营范围包含：一般项目：科技中介服务；科技推广和应用服务；接受金融机构委托从事信息技术和流程外包服务（不含金融信息服务）；信息咨询服务（不含许可类信息咨询服务）；电竞信息科技；信息安全设备制造；地理遥感信息服务；信息技术咨询服务；信息系统集成服务；体育保障组织；创业空间服务；信息安全设备销售；卫星技术综合应用系统集成；网络与信息安全软件开发；数据处理和存储支持服务；物联网技术研发；生物质能资源数据库信息系统平台；票据信息咨询服务；数字技术服务；工业互联网数据服务；接受金融机构委托对信贷逾期户及信用卡透支户进行提醒通知服务（不含金融信息服务）；旅游开发项目策划咨询；人力资源服务（不含职业中介活动、劳务派遣服务）；文化场馆管理服务；物联网技术服务；气象信息服务；软件外包服务；智能农业管理；量子计算技术服务；基于云平台的业务外包服务；环保咨询服务；健康咨询服务（不含诊疗服务）；互联网数据服务；自然科学研究和试验发展；教育咨询服务（不含涉许可审批的教育培训活动）；汽车零部件研发；卫星遥感数据处理；智能家庭消费设备销售；轨道交通运营管理系统开发；市场主体登记注册代理；数字文化创意内容应用服务；房地产咨询；道路货物运输站经营；舆情信息服务（除依法须经批准的项目外，凭营业执照依法自主开展经营活动）。企业当前经营状态为存续。,科学研究和技术服务业,科技推广和应用服务业,-,-
16380,南京原力信息技术有限公司,91320106MA1PBDW355,填报,,数据技术企业,,,,,,,,,,,,,在业,2017-07-04,315.15万元,122万元,南京市,鼓楼区,15,S(小型),"南京原力信息技术有限公司成立于2017-07-04，法定代表人王凌，经营范围包括技术服务、技术咨询及技术服务、信息技术。
南京原力信息技术有限公司近年获得2025年国家级科技型中小企业和2024年省级创新型中小企业称号。
以上内容由AI生成，仅供参考，请注意甄别。",信息传输、软件和信息技术服务业,软件和信息技术服务业,软件开发,-
20950,无锡同文信息科技有限公司,91320214MA255JQH9E,填报,,数据技术企业,,,,,,,,,,,,,存续,2021-02-01,1000万元,-,无锡市,新吴区,0,M(中型),无锡同文信息科技有限公司成立于2021-02-01，法定代表人为TSAO SHENG AUGUSTIN，注册资本为1000万元，统一社会信用代码为91320214MA255JQH9E，企业注册地址位于无锡市新吴区金城大厦1-605室，所属行业为软件和信息技术服务业，经营范围包含：一般项目：软件开发；人工智能基础软件开发；人工智能应用软件开发；网络与信息安全软件开发；人工智能理论与算法软件开发；数字文化创意软件开发；智能水务系统开发；软件外包服务；智能机器人的研发；动漫游戏开发；地理遥感信息服务；软件销售；互联网数据服务；区块链技术相关软件和服务；信息技术咨询服务；人工智能公共服务平台技术咨询服务；数据处理和存储支持服务；电子产品销售；网络设备销售；互联网设备销售；计算机软硬件及辅助设备批发（除依法须经批准的项目外，凭营业执照依法自主开展经营活动）。企业当前经营状态为存续。,信息传输、软件和信息技术服务业,软件和信息技术服务业,-,-
17705,南京市亿达商业管理有限公司,91320104MA27P3JH13,填报,,数据服务企业,,,,,,,,,,,,,在业,2022-09-08,1000万元,1000万元,南京市,江宁区,6,XS(微型),一般项目：企业管理；餐饮管理；商业综合体管理服务；单位后勤管理服务。,租赁和商务服务业,商务服务业,-,-
32054,淮安产城融合投资开发有限公司,91320829MA1W6U5UXF,规上,,数据服务企业,,,,,,,,,,,,,在业,2018-03-13,300000万元,214974万元,淮安市,洪泽区,23,S(小型),淮安产城融合投资开发有限公司成立于2018-03-13，法定代表人为徐向峰，注册资本为300000万元，统一社会信用代码为91320829MA1W6U5UXF，企业注册地址位于淮安市洪泽区南环路33号（水釜城内），所属行业为商务服务业，经营范围包含：实业、股权、建设项目、养老产业、康复医疗产业投资；房地产开发；文化、旅游投资开发与经营管理；土地整理及开发；基础设施建设及经营管理；资产经营与资产管理；社会经济咨询。（依法须经批准的项目，经相关部门批准后方可开展经营活动）。企业当前经营状态为在业。,租赁和商务服务业,商务服务业,组织管理服务,-
18306,江苏天晖律师事务所,31320000682980586K,填报,,数据服务企业,,,,,,,,,,,,,正常,2008-11-26,30万元,-,南京市,江宁区,-,-,-,-,-,-,-
15809,南京石云信息技术有限公司,91320117MAC12CDY45,填报,,数据技术企业,,,,,,,,,,,,,在业,2022-10-17,100万元,100万元,南京市,溧水区,0,S(小型),"南京石云信息技术有限公司成立于2022年10月17日，法定代表人纪彦，公司位于江苏省南京市溧水区。作为一家信息技术服务企业，公司主营业务涵盖技术服务、信息技术咨询服务和信息系统集成服务三大领域，并拥有自主研发的智能调配物流与供应链管理软件。
南京石云信息技术有限公司作为2025年国家级科技型中小企业，在南京市软件和信息技术服务业发展中受益于当地产业集聚优势。公司位于溧水区，能够依托南京重点发展的中国(南京)软件谷和江北新区产业技术研创园两大高层次软件名园的资源支持。在IT服务行业向云服务和智能化转型的背景下，该公司自主研发的智能调配物流与供应链管理软件符合行业技术发展趋势。随着企业信息化建设从传统管理向流程优化和知识管理深化，该公司在系统集成和信息技术咨询服务领域具备业务拓展空间。
以上内容由AI生成，仅供参考，请注意甄别。",信息传输、软件和信息技术服务业,软件和信息技术服务业,-,-
15499,南京哈哈云信息科技有限公司,91320114MA255XYK27,填报,,数据技术企业,,,,,,,,,,,,,在业,2021-02-02,570.64万元,570.64万元,南京市,雨花台区,21,S(小型),"南京哈哈云信息科技有限公司成立于2021年2月2日，法定代表人为杨威。该公司是一家为养老产业集团提供服务的互联网科技企业，专注于通过数字化产品和技术推动行业变革。其服务对象涵盖居家养老、社区养老、养老机构、长者及其子女、助老员以及相关监管机构。
南京哈哈云信息科技有限公司荣获2025年国家级科技型中小企业和2023年国家级高新技术企业称号。该公司创新养老产品获得工信部‘信息消费产品创新奖’，其团队由具备产业互联网经验的专业人才组成，专注于通过科技手段提升健康养老服务水平。南京作为软件和信息技术服务业重点发展区域，为该公司提供了良好的政策和技术支持环境，有助于其在养老产业数字化服务领域的持续创新。
以上内容由AI生成，仅供参考，请注意甄别。",信息传输、软件和信息技术服务业,软件和信息技术服务业,-,-
7222,南通必扑科技有限公司,91320691MADB0L841X,新增导入,数据融合,数据技术企业,数据加工分析,,,,,,,,,,,,在业,2024-01-19,100万元,-,南通市,南通经济技术开发区,3,XS(微型),"南通必扑科技有限公司成立于2024年1月19日，法定代表人艾春燕，位于江苏省南通市南通经济技术开发区。公司主营业务包括住宅室内装饰装修、专业设计服务和技术服务。在技术研发方面，公司拥有多项专利和软件著作权，涉及农业数据清洗、洪涝预警系统、无线传感网络和灾害风险评估等领域。公司的软件著作权包括智慧农业气象灾害预警与视频监测平台、智慧农业检测控制系统、洪涝灾害风险评估分析与监测预警系统等，体现了其在农业科技领域的专业能力。
南通必扑科技有限公司在2025年获得国家级科技型中小企业认定。
以上内容由AI生成，仅供参考，请注意甄别。",科学研究和技术服务业,研究和试验发展,-,-
9903,南京英思达信息技术有限公司,91320105MA20EFAT95,自有,,数据技术企业,人工智能技术企业,,,,,,,,,,,,在业,2019-11-15,200万元,0.8万元,南京市,建邺区,0,S(小型),南京英思达信息技术有限公司成立于2019-11-15，法定代表人为张梅，注册资本为200万元，统一社会信用代码为91320105MA20EFAT95，企业注册地址位于南京市建邺区白龙江东街9号B6幢三层360-128，所属行业为软件和信息技术服务业，经营范围包含：信息技术、人工智能技术、大数据技术研发、技术咨询、技术服务、技术转让；软件研发、销售；计算机软硬件、人工智能产品研发、销售、技术服务；计算机系统集成服务；电脑图文设计、制作。（依法须经批准的项目，经相关部门批准后方可开展经营活动）。企业当前经营状态为在业。,信息传输、软件和信息技术服务业,软件和信息技术服务业,-,-
24767,南京金信通信息服务有限公司,91320104MA1XLXG3X7,规上,,数据技术企业,,,,,,,,,,,,,在业,2018-12-14,5000万元,1470.150664万元,南京市,秦淮区,93,M(中型),"南京金信通信息服务有限公司成立于2018年12月，法定代表人为王凯。公司主营业务包括计算机系统服务、信息技术开发、技术服务、数据处理和软件开发。作为金鹰国际集团旗下科技子公司，公司通过云服务、智慧物联、大数据和人工智能等技术，为企业提供数字化解决方案。
南京金信通信息服务有限公司在2025年获得国家级科技型中小企业称号，2024年被评为省级专精特新中小企业和省级创新型中小企业。
以上内容由AI生成，仅供参考，请注意甄别。",信息传输、软件和信息技术服务业,软件和信息技术服务业,信息系统集成和物联网技术服务,信息系统集成服务
25071,南京轶诺科技有限公司,91320114MA1X0H2AXW,规上,,数据技术企业,,,,,,,,,,,,,在业,2018-08-06,1000万元,53.826万元,南京市,雨花台区,38,S(小型),"南京轶诺科技有限公司成立于2018年8月，法定代表人为沈金波。公司位于南京市雨花台区花神庙10号智慧城市产业园，属于软件和信息技术服务业。作为一家计算机软件企业，公司团队规模在1-49人之间，已在中国境内运营多年并拥有自主知识产权。
南京轶诺科技有限公司近年来获得2025年国家级科技型中小企业、2024年国家级高新技术企业以及2024年省级专精特新中小企业等多项荣誉。在行业地位方面，该公司位于南京市雨花台区智慧城市产业园，依托当地信息技术产业聚集优势，专注于计算机软件研发领域。
以上内容由AI生成，仅供参考，请注意甄别。",信息传输、软件和信息技术服务业,软件和信息技术服务业,-,-
28981,南通星象智能科技有限公司,91320681MAD7RTDQ9T,规上,,数据应用企业,,,,,,,,,,,,,在业,2023-12-22,1000万元,311.9万元,南通市,启东市,0,S(小型),"南通星象智能科技有限公司成立于2023-12-22，法定代表人为陈界霖，注册资本为1000万元，统一社会信用代码为91320681MAD7RTDQ9T，企业注册地址位于江苏省南通市启东市启东经济开发区南苑西路1168号，所属行业为软件和信息技术服务业，经营范围包含：许可项目：通用航空服务（依法须经批准的项目，经相关部门批准后方可开展经营活动，具体经营项目以审批结果为准）
一般项目：智能机器人的研发；工程和技术研究和试验发展；技术服务、技术开发、技术咨询、技术交流、技术转让、技术推广；卫星遥感数据处理；卫星遥感应用系统集成；卫星技术综合应用系统集成；地理遥感信息服务；人工智能理论与算法软件开发；人工智能应用软件开发；人工智能行业应用系统集成服务；人工智能基础资源与技术平台；物联网技术服务；工业互联网数据服务；物联网技术研发；数据处理和存储支持服务；数据处理服务；信息咨询服务（不含许可类信息咨询服务）；信息系统集成服务；环境保护监测；卫星通信服务；海洋气象服务；地震服务；生态资源监测；计算机系统服务；自然科学研究和试验发展；地质灾害治理服务；计算机软硬件及辅助设备零售；工程技术服务（规划管理、勘察、设计、监理除外）；工程管理服务；信息系统运行维护服务；导航、测绘、气象及海洋专用仪器销售；计量技术服务；专业设计服务；工业设计服务；大数据服务；矿产资源储量评估服务；农业科学研究和试验发展；气象观测服务；软件开发；技术进出口；通用设备制造（不含特种设备制造）；专用设备制造（不含许可类专业设备制造）；智能控制系统集成；智能基础制造装备制造；智能无人飞行器制造；智能无人飞行器销售；电池制造；电池零配件生产；电子专用材料研发；新材料技术研发；电子专用材料制造；租赁服务（不含许可类租赁服务）（除依法须经批准的项目外，凭营业执照依法自主开展经营活动）。企业当前经营状态为在业。",信息传输、软件和信息技术服务业,软件和信息技术服务业,软件开发,-
13713,盐城元创动力文化传播有限公司,91320903MA1MMTK56B,自有,,数据应用企业,商贸流通应用企业,,,,,,,,,,,,存续,2016-06-15,100万元,100万元,盐城市,盐都区,2,XS(微型),盐城元创动力文化传播有限公司成立于2016-06-15，法定代表人为张弛，注册资本为100万元，统一社会信用代码为91320903MA1MMTK56B，企业注册地址位于盐城市盐都区潘黄街道东进路55号2幢（人才大厦）8楼803室，所属行业为广播、电视、电影和录音制作业，经营范围包含：平面、动画广告制作传播；大数据技术、物联网技术、微电影、电视技术研究开发与应用；影视片创意策划制作；数字媒体技术开发及创意策划；互联网技术及创意策划；装饰装潢工程设计、施工；艺术创意培训；大型活动综合策划传播；音视频通信安防网络工程施工；代理媒体广告制作发布；影视节目制作，影视节目发行。（依法须经批准的项目，经相关部门批准后方可开展经营活动）一般项目：人力资源服务（不含职业中介活动、劳务派遣服务）（除依法须经批准的项目外，凭营业执照依法自主开展经营活动）。企业当前经营状态为存续。,文化、体育和娱乐业,广播、电视、电影和录音制作业,-,-
13685,盐城满易物流科技有限公司,91320922MA20B0MC9E,自有,,数据技术企业,数据流通交易技术企业,,,,,,,,,,,,在业,2019-10-30,5万元,-,盐城市,滨海县,0,XS(微型),"盐城满易物流科技有限公司成立于2019-10-30，法定代表人为李加兵，注册资本为5万元，统一社会信用代码为91320922MA20B0MC9E，企业注册地址位于盐城市滨海县通榆镇民营创业园，所属行业为研究和试验发展，经营范围包含：物流技术研发及其技术转让；供应链管理服务；道路普通货物运输；普通货物仓储服务；道路货物运输代理；物流信息咨询；普通货物装卸、搬运服务。（依法须经批准的项目,经相关部门批准后方可开展经营活动）。企业当前经营状态为在业。",科学研究和技术服务业,研究和试验发展,工程和技术研究和试验发展,工程和技术研究和试验发展
18755,江苏恒领律师事务所,31320000MD03250803,填报,,数据服务企业,,,,,,,,,,,,,正常,2023-12-25,30万元,-,南京市,江宁区,-,-,-,-,-,-,-
25849,南京海员之家信息服务有限公司,9132010677701353XU,规上,,数据服务企业,,,,,,,,,,,,,在业,2005-08-08,626.6666万元,200万元,南京市,鼓楼区,33,S(小型),"南京海员之家信息服务有限公司成立于2005-08-08，法定代表人为戴贤国，注册资本为626.6666万元，统一社会信用代码为9132010677701353XU，企业注册地址位于南京市鼓楼区南通路118号3幢501室，所属行业为商务服务业，经营范围包含：许可项目：劳务派遣服务；海员外派业务；水路普通货物运输；省际普通货船运输、省内船舶运输；国内船舶管理业务（依法须经批准的项目，经相关部门批准后方可开展经营活动，具体经营项目以审批结果为准）
一般项目：无船承运业务；货物进出口；技术进出口；国际货物运输代理；国内货物运输代理；国内集装箱货物运输代理；船舶港口服务；打捞服务；装卸搬运；包装服务；技术服务、技术开发、技术咨询、技术交流、技术转让、技术推广；网络技术服务；信息技术咨询服务；信息咨询服务（不含许可类信息咨询服务）；网络与信息安全软件开发；普通机械设备安装服务；安全咨询服务；业务培训（不含教育培训、职业技能培训等需取得许可的培训）；专用设备修理；人力资源服务（不含职业中介活动、劳务派遣服务）；劳务服务（不含劳务派遣）；船舶拖带服务；国际船舶管理业务；船舶销售；船舶租赁；水上运输设备零配件销售；海上国际货物运输代理；陆路国际货物运输代理；从事国际集装箱船、普通货船运输；普通货物仓储服务（不含危险化学品等需许可审批的项目）；国内船舶代理；国际船舶代理；国内贸易代理；港口理货；港口货物装卸搬运活动；港口设施设备和机械租赁维修业务；水上运输设备销售；运输设备租赁服务；内河船员事务代理代办服务（除依法须经批准的项目外，凭营业执照依法自主开展经营活动）。企业当前经营状态为在业。",租赁和商务服务业,商务服务业,咨询与调查,-
11098,苏州名都网络信息技术有限公司,913205087953958262,自有,,数据技术企业,数据治理应用技术企业,,,,,,,,,,,,存续,2006-12-01,85万元,85万元,苏州市,姑苏区,0,XS(微型),苏州名都网络信息技术有限公司成立于2006-12-01，法定代表人为王俊清，注册资本为85万元，统一社会信用代码为913205087953958262，企业注册地址位于苏州市姑苏区桐泾南路333号胥江岸花园1幢201室，所属行业为商务服务业，经营范围包含：网站建设和推广、网络数据库信息维护。企业当前经营状态为存续。,租赁和商务服务业,商务服务业,咨询与调查,-
19059,南京雅美格酒店管理有限公司,91320102MA22UNCR67,填报,,数据服务企业,,,,,,,,,,,,,存续,2020-10-29,100万元,-,南京市,玄武区,8,XS(微型),南京雅美格酒店管理有限公司成立于2020-10-29，法定代表人为赵震，注册资本为100万元，统一社会信用代码为91320102MA22UNCR67，企业注册地址位于南京市玄武区北京东路44号，所属行业为商务服务业，经营范围包含：许可项目：餐饮服务；住宿服务；食品经营（销售预包装食品）；出版物零售（依法须经批准的项目，经相关部门批准后方可开展经营活动，具体经营项目以审批结果为准）一般项目：酒店管理；餐饮管理；会议及展览服务；洗染服务；停车场服务；住房租赁；日用百货销售；化妆品零售；服装服饰零售；家用电器销售；五金产品零售；电子产品销售（除依法须经批准的项目外，凭营业执照依法自主开展经营活动）。企业当前经营状态为存续。,租赁和商务服务业,商务服务业,-,-
30522,徐州宏旺科技服务有限公司,91320382MADAN9Q99E,规上,,数据应用企业,,,,,,,,,,,,,在业,2024-01-12,100万元,-,徐州市,邳州市,0,XS(微型),徐州宏旺科技服务有限公司成立于2024-01-12，法定代表人为彭星雨，注册资本为100万元，统一社会信用代码为91320382MADAN9Q99E，企业注册地址位于江苏省徐州市邳州市炮车街道高新技术产业开发区高新智谷A9-105-167，所属行业为科技推广和应用服务业，经营范围包含：一般项目：技术服务、技术开发、技术咨询、技术交流、技术转让、技术推广；科技中介服务；软件外包服务；企业管理；人力资源服务（不含职业中介活动、劳务派遣服务）；供应链管理服务；生产线管理服务；国内货物运输代理；运输设备租赁服务；装卸搬运；包装服务；普通货物仓储服务（不含危险化学品等需许可审批的项目）（除依法须经批准的项目外，凭营业执照依法自主开展经营活动）。企业当前经营状态为在业。,科学研究和技术服务业,科技推广和应用服务业,-,-
23704,宿迁国京增华信息技术有限公司,91321311MA234CEQXQ,填报,,数据技术企业,,,,,,,,,,,,,存续,2020-11-13,100万元,-,宿迁市,宿豫区,0,XS(微型),宿迁国京增华信息技术有限公司成立于2020-11-13，法定代表人为戚天骄，注册资本为100万元，统一社会信用代码为91321311MA234CEQXQ，企业注册地址位于宿迁市宿豫区洪泽湖东路19号恒通大厦421-424室-YS00699，所属行业为科技推广和应用服务业，经营范围包含：一般项目：技术服务、技术开发、技术咨询、技术交流、技术转让、技术推广；企业管理咨询；信息技术咨询服务；会议及展览服务；劳务服务（不含劳务派遣）；广告设计、代理；广告发布（非广播电台、电视台、报刊出版单位）；广告制作；版权代理；住房租赁；非居住房地产租赁；物业管理（除依法须经批准的项目外，凭营业执照依法自主开展经营活动）。企业当前经营状态为存续。,科学研究和技术服务业,科技推广和应用服务业,技术推广服务,-
23260,常州市力盛电机厂（普通合伙）,91320411748184209G,填报,,数据应用企业,,,,,,,,,,,,,存续,2003-04-08,40万元,40万元,常州市,新北区,0,XS(微型),-,制造业,专用设备制造业,-,-
